{
  "schema_version": "1.0",
  "snapshot_id": "business-to-brand-<source-sha256-prefix>",
  "source_workspace": "projects/<project-slug>/market_research",
  "source_manifest_version": "1.0",
  "business_identity": {},
  "segment": {},
  "job_and_pain": {},
  "positioning": {},
  "buying_context": {},
  "customer_language": [],
  "channels_and_contexts": {},
  "field_provenance": {},
  "evidence_refs": [],
  "coverage_gaps": [],
  "user_overrides": {},
  "source_sha256": "<64-lowercase-hex>"
}
